{
  "schema_version": "villani.attempt.v1",
  "attempt_id": "attempt_002",
  "run_id": "run_protocol_fixture",
  "trace_id": "trace_protocol_fixture",
  "ordinal": 2,
  "backend_name": "fixture_capable",
  "runner_name": "villani_code",
  "model": "fixture-large",
  "status": "completed",
  "started_at": "2026-07-10T00:00:12Z",
  "completed_at": "2026-07-10T00:00:17Z",
  "worktree_path": ".worktrees/attempt_002",
  "patch_path": "attempts/attempt_002/patch.diff",
  "patch_sha256": "a3e3d61b6c36a12869d2ef6ad0dbd4643e109d964e92a62aecc368a1a01a0f8f",
  "patch_bytes": 194,
  "stdout_path": "attempts/attempt_002/stdout.log",
  "stderr_path": "attempts/attempt_002/stderr.log",
  "runner_telemetry_path": "attempts/attempt_002/runner_telemetry.json",
  "trace_path": "attempts/attempt_002/trace/events.jsonl",
  "exit_code": 0,
  "duration_ms": 5000,
  "duration_accounting_status": "complete",
  "input_tokens": 100,
  "output_tokens": 55,
  "token_accounting_status": "complete",
  "cost_usd": 0.04,
  "cost_accounting_status": "complete",
  "error": null,
  "metadata": {},
  "agent_system_id": "asys_80147fac99d0bfffb4605d4a447ad9a0b6d6e947426c95efcf7168cc6ec94dfa",
  "agent_system_identity_path": "agent-systems/asys_80147fac99d0bfffb4605d4a447ad9a0b6d6e947426c95efcf7168cc6ec94dfa.json",
  "harness_result_path": "attempts/attempt_002/harness-result.json"
}
