{
  "schema_version": "villani.attempt.v1",
  "attempt_id": "attempt_001",
  "run_id": "run_protocol_fixture",
  "trace_id": "trace_protocol_fixture",
  "ordinal": 1,
  "backend_name": "fixture_economy",
  "runner_name": "villani_code",
  "model": "fixture-small",
  "status": "completed",
  "started_at": "2026-07-10T00:00:04Z",
  "completed_at": "2026-07-10T00:00:08Z",
  "worktree_path": ".worktrees/attempt_001",
  "patch_path": "attempts/attempt_001/patch.diff",
  "patch_sha256": "6c0645c428f875a091870e4ffef8cb5f5b3d2b9334e3fcb337978a95d397b358",
  "patch_bytes": 194,
  "stdout_path": "attempts/attempt_001/stdout.log",
  "stderr_path": "attempts/attempt_001/stderr.log",
  "runner_telemetry_path": "attempts/attempt_001/runner_telemetry.json",
  "trace_path": "attempts/attempt_001/trace/events.jsonl",
  "exit_code": 0,
  "duration_ms": 4000,
  "duration_accounting_status": "complete",
  "input_tokens": 80,
  "output_tokens": 40,
  "token_accounting_status": "complete",
  "cost_usd": 0.01,
  "cost_accounting_status": "complete",
  "error": null,
  "metadata": {}
}
